content,cleaned_content,score,accuracy,completeness,satisfaction
"saya mencoba masuk akun dana lagi, tapi otp tidak menerima otp. karena email sudah tidak terpasang di handphone. bagaimana cara merubah email di akun dana? atau bagaimana cara merubah akan otp bisa masuk lewat pesan / via WhatsApp","saya mencoba masuk akun dana lagi, tapi otp tidak menerima otp. karena email sudah tidak terpasang di handphone. bagaimana cara merubah email di akun dana? atau bagaimana cara merubah akan otp bisa masuk lewat pesan via whatsapp",2,1,1,0
"fitur dana cicil di sarankan di hapus saja karna tidak ada gunanya. saat melakukan peminjaman masak di sedot dr ATM kita, kalau ada saldo ngapain ajukan pinjaman.....","fitur dana cicil di sarankan di hapus saja karna tidak ada gunanya. saat melakukan peminjaman masak di sedot dr atm kita, kalau ada saldo ngapain ajukan pinjaman.....",1,0,0,1
"MENGECEWAKAN SEKLAI, FITUR DANA CICIL TIDAK MUNCUL SI APLIKASI SAYA, PADAHAL SAYA AKTIF TRANSAKSI DI DANA, TIDAK PUNYA HUTANG DIMANAPUN, KOL 1 DATA SAYA, TETAPI FITUR DANA CICIL TIDAK MUNCUL. SEMENTARA ORANG2 YG GA BENER BAYAR ANGSURAN PADA DI ACC. ANEH APK NIH","mengecewakan seklai, fitur dana cicil tidak muncul si aplikasi saya, padahal saya aktif transaksi di dana, tidak punya hutang dimanapun, kol 1 data saya, tetapi fitur dana cicil tidak muncul. sementara orang2 yg ga bener bayar angsuran pada di acc. aneh apk nih",1,0,1,1
"tolong dong ini gimana sih masa saya habis investasi emas 300.000 tapi gak masuk, padahal pembayaran sukses, kecewa saya","tolong dong ini gimana sih masa saya habis investasi emas 300.000 tapi gak masuk, padahal pembayaran sukses, kecewa saya",1,1,0,1
ga bisa di buka.. dana tlah berhenti terus,ga bisa di buka.. dana tlah berhenti terus,2,1,0,1
"diturunkan dulu bintangnya, sering bermasalah","diturunkan dulu bintangnya, sering bermasalah",3,1,0,1
susah buka aplikasi nya.Kalau udah kebuka balik lagi ke menu awal,susah buka aplikasi nya.kalau udah kebuka balik lagi ke menu awal,1,1,0,1
"saya ganti jadi bintang 1, di karnakan dana sekarang banyak gangguannya sudah sering uang saya ilang..tranferan gamasuklah.pendinglah.. sangat merugikan","saya ganti jadi bintang 1, di karnakan dana sekarang banyak gangguannya sudah sering uang saya ilang..tranferan gamasuklah.pendinglah.. sangat merugikan",1,1,0,1
"aku kan nabung uang di mas giliran mau login trus mau narik uangnya ga bisa, kyk lemot gitu padahal aku uda pake wf sma data ga bisa bisa, tolong perbaiki lagi","aku kan nabung uang di mas giliran mau login trus mau narik uangnya ga bisa, kyk lemot gitu padahal aku uda pake wf sma data ga bisa bisa, tolong perbaiki lagi",1,1,0,1
aplikasi jelek banyak bug nya asli dah bikin keselll,aplikasi jelek banyak bug nya asli dah bikin keselll,1,1,0,1
"dana eror parah,transaksi pending tpi saldo blum terpotong,trus transaksi lagi bisa saldo terpotong 2 kali, mau komplen susah,alhasil rugi satu kali trnsaksi,😥","dana eror parah,transaksi pending tpi saldo blum terpotong,trus transaksi lagi bisa saldo terpotong 2 kali, mau komplen susah,alhasil rugi satu kali trnsaksi,",1,1,1,1
gabisa ganti nomer malah error aneh ini aplikasi ga guna gabisa narik saldo mentok di otp,gabisa ganti nomer malah error aneh ini aplikasi ga guna gabisa narik saldo mentok di otp,1,1,0,1
sangat disayangkan sudah percaya dengan aplikasi ini malah dikecewakan dengan potongan dan tidak ada tanggung jawabnya perihal potongan uang dan transaksi e-toll transaksi berhasil saldo tida masuk ke etol mohon untuk di perhatikan hal tersebut tanpa ada pemberitahuan uang saya di potong astaghfirullah,sangat disayangkan sudah percaya dengan aplikasi ini malah dikecewakan dengan potongan dan tidak ada tanggung jawabnya perihal potongan uang dan transaksi e toll transaksi berhasil saldo tida masuk ke etol mohon untuk di perhatikan hal tersebut tanpa ada pemberitahuan uang saya di potong astaghfirullah,1,1,0,1
saya kasih 3 bintang karna transfer saya belum juga selesai udah hampir 2 hari 2 malam. ini gimna maksud nya,saya kasih 3 bintang karna transfer saya belum juga selesai udah hampir 2 hari 2 malam. ini gimna maksud nya,3,1,0,1
mangkin gak jelas.. aplikasi sering eror,mangkin gak jelas.. aplikasi sering eror,1,1,0,1
semakin kesini semmakin buruuuuuuuuk setiap hari pay eroooor,semakin kesini semmakin buruuuuuuuuk setiap hari pay eroooor,1,1,0,1
mana saldoku 17.990 udh 2 hari udh melapor bukannya di proses malah di diamkan,mana saldoku 17.990 udh 2 hari udh melapor bukannya di proses malah di diamkan,1,1,1,1
"ini udah 1x24 jam uang saya masih belum masuk sebesar 4.040.000 jika 1x24 jam lagi uang saya masih belum masuk saya akan buat laporan ke pihak bank BRI bahkan saya akan buat laporan ke kepolisian tentang pencurian, bukti bukti sudah ada","ini udah 1x24 jam uang saya masih belum masuk sebesar 4.040.000 jika 1x24 jam lagi uang saya masih belum masuk saya akan buat laporan ke pihak bank bri bahkan saya akan buat laporan ke kepolisian tentang pencurian, bukti bukti sudah ada",1,1,0,1
eror min benerin GC,eror min benerin gc,1,1,0,1
"dana sekarang rusak anjir,lama banget ngirimnya,gak seperti biasanya","dana sekarang rusak anjir,lama banget ngirimnya,gak seperti biasanya",1,1,0,1
"ya hilang dah uang aku gara"" apl dana skrg udah tidak aman udah bisa d bobol sama para pelaku penipu gpp ikhlas tp cukup sekali ini aja padahal udah akun premium tp masih aja bisa k bobolan akun ku...sekian dan by dana untuk tanggungan ku gak usah d tagih ya perkaranya tagihan cuma 80rb an tp uang ku yg hilang gegara akun ku d retas dan uang ku yg hilang juga nominal 1jt jadi impas ajalah ya dan males juga urusan sama kalian...",ya hilang dah uang aku gara apl dana skrg udah tidak aman udah bisa d bobol sama para pelaku penipu gpp ikhlas tp cukup sekali ini aja padahal udah akun premium tp masih aja bisa k bobolan akun ku...sekian dan by dana untuk tanggungan ku gak usah d tagih ya perkaranya tagihan cuma 80rb an tp uang ku yg hilang gegara akun ku d retas dan uang ku yg hilang juga nominal 1jt jadi impas ajalah ya dan males juga urusan sama kalian...,1,1,0,1
kenapa mau meminta petunjuk dari Diana tidak bisa di buka atau tidak bisa terbuka fitur layanan bantuan di dana,kenapa mau meminta petunjuk dari diana tidak bisa di buka atau tidak bisa terbuka fitur layanan bantuan di dana,1,1,1,1
"tolong di konfirmasi,saya ada kendala saat transaksi beli kuota di sini jika emang ada kendala harusnya ada notif sebelumnya bukan udah beli baru ada notif kendala uang saya tidak kembali mohon konfirmasi kasihan yang udah beli saldo buat beli kuota di dana tapi malah kasihan!! dulu saya juga naroh uang Disini nominal besar tapi tiba"" hilang mngsudnya apa coba","tolong di konfirmasi,saya ada kendala saat transaksi beli kuota di sini jika emang ada kendala harusnya ada notif sebelumnya bukan udah beli baru ada notif kendala uang saya tidak kembali mohon konfirmasi kasihan yang udah beli saldo buat beli kuota di dana tapi malah kasihan!! dulu saya juga naroh uang disini nominal besar tapi tiba hilang mngsudnya apa coba",1,1,0,1
sesi anda kadaluarsa.. maksudnya apa min.. saya mau trnfer e walet ga bisa².. perbaiki tolong,sesi anda kadaluarsa.. maksudnya apa min.. saya mau trnfer e walet ga bisa .. perbaiki tolong,1,1,0,1
ko skrg jd lola yah... mau bli kuota or pulsa aja polanya minta ampun,ko skrg jd lola yah... mau bli kuota or pulsa aja polanya minta ampun,1,1,0,1
"gw ngisi uang selalu ilang, jangan ada yg ngunduh nih aplikasi bnyk tipu nya","gw ngisi uang selalu ilang, jangan ada yg ngunduh nih aplikasi bnyk tipu nya",1,1,0,1
Masa Isi paket data lama skli prosesnya gw harus nunggu sejam Aplikasi paling jelek yg pernah gw download,masa isi paket data lama skli prosesnya gw harus nunggu sejam aplikasi paling jelek yg pernah gw download,1,1,0,1
"Masa mau minta nomor pengirim saja disembunyikan, mau hubungi cs aja kendala2 terus, padahal kami mau minta uang kami yg belum terkirim oleh pengirim Masalahnya saya mau menjelaskan langsung ke costumer service aja tidak bisa, bot DIANA yg ada. Bagaimana cara buat laporan, kan yg saya hadapi bot DIANA, sudah saya bilang chat cs tapi respon bot nya lain.","masa mau minta nomor pengirim saja disembunyikan, mau hubungi cs aja kendala2 terus, padahal kami mau minta uang kami yg belum terkirim oleh pengirim masalahnya saya mau menjelaskan langsung ke costumer service aja tidak bisa, bot diana yg ada. bagaimana cara buat laporan, kan yg saya hadapi bot diana, sudah saya bilang chat cs tapi respon bot nya lain.",1,1,1,1
"akun dana sering tiba"" log out saldo dana juga ilang gmn sih padahal buat makan Lo",akun dana sering tiba log out saldo dana juga ilang gmn sih padahal buat makan lo,1,1,0,1
"Apakah saldo saya tetap masuk?saya sudah melakukan top up hari ini tapi sampe sekarang notifikasi dan saldo belum juga masuk,tapi di status pengirimannya sukses,,saya harus menunggu berapa lama?tolong dong kak apk dana nya bisa lebih di perbaiki lagi keamanannya🙏dan saya berharap semoga keluhan saya bisa cepat d tanggapi,,krna in bukan uang sdikit","apakah saldo saya tetap masuk?saya sudah melakukan top up hari ini tapi sampe sekarang notifikasi dan saldo belum juga masuk,tapi di status pengirimannya sukses,,saya harus menunggu berapa lama?tolong dong kak apk dana nya bisa lebih di perbaiki lagi keamanannya dan saya berharap semoga keluhan saya bisa cepat d tanggapi,,krna in bukan uang sdikit",1,1,0,1
"5 tahun udah pake, hari ini mau bayar gabisa, tapi saldo berkurang, bejat. gapake pake lagi","5 tahun udah pake, hari ini mau bayar gabisa, tapi saldo berkurang, bejat. gapake pake lagi",1,1,0,1
reksa dana di cair kan malah ngk masuk jadi saldo sudahlah di suruh tunggu 1 minggu. ini udah 2 minggu malh saldo nya ngk masuk² apk scam padahal aku harian make apk ini kecewa sii. transaksi nya berhasil malah saldo nya blom masuk juga. tolong di perbaiki lagi sistem nya.,reksa dana di cair kan malah ngk masuk jadi saldo sudahlah di suruh tunggu 1 minggu. ini udah 2 minggu malh saldo nya ngk masuk apk scam padahal aku harian make apk ini kecewa sii. transaksi nya berhasil malah saldo nya blom masuk juga. tolong di perbaiki lagi sistem nya.,1,1,0,1
uang saya hilang terus,uang saya hilang terus,1,1,0,1
"halo DANA Dompet Digital Indonesia, kenapa aplikasi dana saya tidak bisa di Transfer sama teman? katanya tidak bisa di kirim, tolong bantuan, terimakasih","halo dana dompet digital indonesia, kenapa aplikasi dana saya tidak bisa di transfer sama teman? katanya tidak bisa di kirim, tolong bantuan, terimakasih",3,1,0,0
saya sudah bayar dana cicil saya sebelum waktunya eh pas mau pake lagi tidak bisa. apl gak jelas,saya sudah bayar dana cicil saya sebelum waktunya eh pas mau pake lagi tidak bisa. apl gak jelas,2,1,0,1
"berapa lama sebenarnya pengalihan saldo akun lama ke baru?udh di ikutin semua intruksi nya saldo saya dak di alihkan dari akun lama,akun lama no nya dak aktif di suruh ganti no baru pakai KTP yg sama transfer akun, udh tranfer akun saldo nya dak di alihkan ga jelas ni aplikasi lama""","berapa lama sebenarnya pengalihan saldo akun lama ke baru?udh di ikutin semua intruksi nya saldo saya dak di alihkan dari akun lama,akun lama no nya dak aktif di suruh ganti no baru pakai ktp yg sama transfer akun, udh tranfer akun saldo nya dak di alihkan ga jelas ni aplikasi lama",1,1,0,1
maaf sblum nya apk dana nya ga bisa di bukaa sama sekali sudah di cobaa pake cara apa pun tetap ga bisaaa,maaf sblum nya apk dana nya ga bisa di bukaa sama sekali sudah di cobaa pake cara apa pun tetap ga bisaaa,2,1,0,1
maaf kak ini kenapa yah dihandphone oppo a7 ngga bisa dibuka?,maaf kak ini kenapa yah dihandphone oppo a7 ngga bisa dibuka?,1,1,0,0
fitur dana cicil saya belum keluar,fitur dana cicil saya belum keluar,2,0,1,0
aplikasi nya kurang tiba² saldo saya hilang,aplikasi nya kurang tiba saldo saya hilang,1,1,0,1
"makin hari makin gajelas aplikasi dana,akun saya tiba-tiba di bekukan katanya harus upgrade ke premium,ehh udah saya upgrade masih juga di bekukan padahal saldo saya ada di dalam nya,jadinya susah saya untuk mentraksaksi,tolong lah di perbaiki,kalo dana masih seperti ini juga,cukup lah ini terakhir pakai dana,makin gajelas dana,tolong akun saya di buka kembali!!!","makin hari makin gajelas aplikasi dana,akun saya tiba tiba di bekukan katanya harus upgrade ke premium,ehh udah saya upgrade masih juga di bekukan padahal saldo saya ada di dalam nya,jadinya susah saya untuk mentraksaksi,tolong lah di perbaiki,kalo dana masih seperti ini juga,cukup lah ini terakhir pakai dana,makin gajelas dana,tolong akun saya di buka kembali!!!",1,1,1,1
"nyesal banget pakai dana, saya topup brizi lumayan la nominal nya tapi ga masuk2 padahal status nya berhasil tapi saldo nya ga masuk ke kartu ga ke update... udah lapor ke cs dana ga ada respon sampe sekarang udah 2 minggu lebih benar-benar lepas tangan... kecewa banget pokoknya.. minimal kasih penjelasan... demi allah saya ngomong yang sejujurnya, saya harap ada penyelesaian dari pihak dana minimal penjelasan!","nyesal banget pakai dana, saya topup brizi lumayan la nominal nya tapi ga masuk2 padahal status nya berhasil tapi saldo nya ga masuk ke kartu ga ke update... udah lapor ke cs dana ga ada respon sampe sekarang udah 2 minggu lebih benar benar lepas tangan... kecewa banget pokoknya.. minimal kasih penjelasan... demi allah saya ngomong yang sejujurnya, saya harap ada penyelesaian dari pihak dana minimal penjelasan!",1,1,1,1
saya sangat kecewe dengan aplikasi ini sudah berapa kali saja mengajukan dana cicil tapi tetap tidak di acc. padahal sudah sering bertransaksi masih saja tidak di acc lebih baik jaga ada yang instal aplikasi seperti ini,saya sangat kecewe dengan aplikasi ini sudah berapa kali saja mengajukan dana cicil tapi tetap tidak di acc. padahal sudah sering bertransaksi masih saja tidak di acc lebih baik jaga ada yang instal aplikasi seperti ini,1,0,1,1
bagaimana cara memunculkan dana cicil saya?,bagaimana cara memunculkan dana cicil saya?,3,0,1,0
Saya tidak bisah masuk ke akun dana saya karna tidak bisah terima kode OTP kartu hilang,saya tidak bisah masuk ke akun dana saya karna tidak bisah terima kode otp kartu hilang,3,1,1,0
kenapa dana cicil saya sudah 5 bulan gak bisa dipakai nih . limit juga gak bertambah2 pdahal tiap bulan transaksi selalu pakai dana ..gimana ini,kenapa dana cicil saya sudah 5 bulan gak bisa dipakai nih . limit juga gak bertambah2 pdahal tiap bulan transaksi selalu pakai dana ..gimana ini,3,1,0,1
eror Mulu dah heran gw mah,eror mulu dah heran gw mah,1,1,0,1
tidak bisa buat beli token listrik,tidak bisa buat beli token listrik,1,1,0,0
parah aplikasi ini saya baru isi uang 300rbu ke dana. malah kepotong otomatis dari google chrome. Angus uang 300ribu ilang,parah aplikasi ini saya baru isi uang 300rbu ke dana. malah kepotong otomatis dari google chrome. angus uang 300ribu ilang,1,1,0,1
ganti nomor ponsel bisa tidak? tidak bisa login otomatis setelah di update mohon solusinya min,ganti nomor ponsel bisa tidak? tidak bisa login otomatis setelah di update mohon solusinya min,1,1,1,0
