content,cleaned_content,score,accuracy,completeness,satisfaction
kenapa skrng tidak bisa transaksi...,kenapa skrng tidak bisa transaksi...,1,1,0,1
kasus terjadi nya uang hilang banyak banget keamanan nya jelek,kasus terjadi nya uang hilang banyak banget keamanan nya jelek,1,1,0,1
"aplikasi paling gak jelas, transfer aja gak bisa bisa","aplikasi paling gak jelas, transfer aja gak bisa bisa",1,1,0,1
gak bisa muncul dana cicil,gak bisa muncul dana cicil,2,0,1,1
banyak potongan kurang bagus jleeek,banyak potongan kurang bagus jleeek,1,0,0,1
pemotongan saldo otomatis di google tanpa konfirmasi,pemotongan saldo otomatis di google tanpa konfirmasi,1,1,0,1
ukuran MB tralu gede . ngelag,ukuran mb tralu gede . ngelag,1,1,0,1
eror tidak bisa transaksi secera mulus🤮,eror tidak bisa transaksi secera mulus,1,1,0,1
sering mental gak bisa di buka,sering mental gak bisa di buka,1,1,0,1
lengkapi fitur dana instan dong,lengkapi fitur dana instan dong,1,0,1,0
kurang suka sih soalnya uangnya cuma di kasih 1 minimal 10jt lah🤭,kurang suka sih soalnya uangnya cuma di kasih 1 minimal 10jt lah,1,0,1,1
"dana gblk ,tiba2 bayar Roblox ga ada konfirmasi apa2 ,tau2 ilang aja duit","dana gblk ,tiba2 bayar roblox ga ada konfirmasi apa2 ,tau2 ilang aja duit",1,1,0,1
dana saya ke Otong sendiri mohon di kembalikan saya tidak melakukan transaksi,dana saya ke otong sendiri mohon di kembalikan saya tidak melakukan transaksi,1,1,0,1
naon aplikasi dana teh tukang nyolong... transfer ke bank lain... ai dina laporan transaksi berhasil.. di cek saldo msih kosong. berati aplikasi dana tukang maling dong..,naon aplikasi dana teh tukang nyolong... transfer ke bank lain... ai dina laporan transaksi berhasil.. di cek saldo msih kosong. berati aplikasi dana tukang maling dong..,1,1,0,1
tolong di bnerin msa mau scan QR gbsa²,tolong di bnerin msa mau scan qr gbsa,1,1,0,1
customer service untuk penanganan penipuan/kesalahan transfer/qris tidak ada hasil dan tidak terlihat ada tindakan apapun,customer service untuk penanganan penipuan kesalahan transfer qris tidak ada hasil dan tidak terlihat ada tindakan apapun,3,0,1,1
"saya kasih bintang 2,karena skrng saya mau bayar tagihan tpi kena pending gtw dan pending nya nunggu sehari, tolong di perbaiki karena saya mau bayar tagihan","saya kasih bintang 2,karena skrng saya mau bayar tagihan tpi kena pending gtw dan pending nya nunggu sehari, tolong di perbaiki karena saya mau bayar tagihan",2,1,0,1
Uangnya ngakk aman didalam,uangnya ngakk aman didalam,1,1,0,1
layanan yang tidak memuaskan,layanan yang tidak memuaskan,1,0,0,1
ga bisa di upgrade,ga bisa di upgrade,1,1,1,1
"Jelek mau daftar udh masukin no telepon trs pencet lanjut malah keluar dri aplikasi, gitu aja terus!","jelek mau daftar udh masukin no telepon trs pencet lanjut malah keluar dri aplikasi, gitu aja terus!",1,1,0,1
"apk nya bagus , tpi sering erorr tolong di perbaiki lagi, karna ini menyangkut uang, bahaya nya klo lagi buat belanja terus apknya erorr gimana coba??? apk busuk klo lagi mau scan gk bisa ini yg bikin gk mikir di perbaiki lagi jng asal bikin apk doang ini kan di dalam dana duit buat bayar..","apk nya bagus , tpi sering erorr tolong di perbaiki lagi, karna ini menyangkut uang, bahaya nya klo lagi buat belanja terus apknya erorr gimana coba??? apk busuk klo lagi mau scan gk bisa ini yg bikin gk mikir di perbaiki lagi jng asal bikin apk doang ini kan di dalam dana duit buat bayar..",1,1,0,1
apa apa an app dana ini?!!!! pakek acara eror segala. pdahal mau nerima tf an kok gak bisa bisa!!! malah gangguan!!! ga jelas aplikasi ini!!!,apa apa an app dana ini?!!!! pakek acara eror segala. pdahal mau nerima tf an kok gak bisa bisa!!! malah gangguan!!! ga jelas aplikasi ini!!!,1,1,0,1
dana udah ada biaya admin hilangin lah biaya admin nyaa😡😡,dana udah ada biaya admin hilangin lah biaya admin nyaa,2,0,0,1
"ini kenapa ga bisa ngeklaim dsna poin padahal mau tak tuker ke voucher saldo dana tapi selalu ada bacaan hadiah abis, ini penipuan atau gimana? saya stay dari jam 9:55 nunggu jam. 10:00 pas tapi pas saya mau tukerin selalu habis saya kira pak buru buru ternyata tetap aja saya udah duluan tapi ada bacanya habis tolong di perbaiki lagi🙏,dan kasih tau mulainya dari jam brp saya stay jam 9:55 blm mulai hadiah tukernya, tapi pas saya jam 10:00pas eh malah bacaan hadia abis tolong dong yang jelas 🙏","ini kenapa ga bisa ngeklaim dsna poin padahal mau tak tuker ke voucher saldo dana tapi selalu ada bacaan hadiah abis, ini penipuan atau gimana? saya stay dari jam 9 55 nunggu jam. 10 00 pas tapi pas saya mau tukerin selalu habis saya kira pak buru buru ternyata tetap aja saya udah duluan tapi ada bacanya habis tolong di perbaiki lagi ,dan kasih tau mulainya dari jam brp saya stay jam 9 55 blm mulai hadiah tukernya, tapi pas saya jam 10 00pas eh malah bacaan hadia abis tolong dong yang jelas",3,1,0,1
gimana caranya ngambil uang di dana yang belum premium,gimana caranya ngambil uang di dana yang belum premium,2,0,1,0
"Jahat banget dana, saya melakukan topup udah transfer lewat qris malah ga masuk DM nya, di googleplay dibatalin saya minta refund malah suruh upgrade premium dulu?!","jahat banget dana, saya melakukan topup udah transfer lewat qris malah ga masuk dm nya, di googleplay dibatalin saya minta refund malah suruh upgrade premium dulu?!",1,1,1,1
aplikasi yang tidak jelas dan tidak bisa berkomitmen dalam memberikan informasi keberhasilan pengiriman uang. jangan pakai aplikasi ini deh saran saya. nama besar di indonesia tapi kurang maksimal dalam memuaskan konsumen,aplikasi yang tidak jelas dan tidak bisa berkomitmen dalam memberikan informasi keberhasilan pengiriman uang. jangan pakai aplikasi ini deh saran saya. nama besar di indonesia tapi kurang maksimal dalam memuaskan konsumen,1,1,0,1
ini dana kenapa ya dri tadi gak bsa transaksi malah tulisan nya sibuk sedang bnyak transaksi ya kali sampai 1 jam gak ada jeda sama sekali,ini dana kenapa ya dri tadi gak bsa transaksi malah tulisan nya sibuk sedang bnyak transaksi ya kali sampai 1 jam gak ada jeda sama sekali,3,1,0,1
Selalu Dalam. Masalah Hingga berhari - hari,selalu dalam. masalah hingga berhari hari,1,1,0,1
aplikasi eror tidak bisa di buka,aplikasi eror tidak bisa di buka,1,1,0,1
liat hasil pengiriman atau yg di kirim tdk bisa,liat hasil pengiriman atau yg di kirim tdk bisa,1,1,0,1
Parah engga bisa masuk . Ga bisa daftar ke apps dana,parah engga bisa masuk . ga bisa daftar ke apps dana,1,1,0,1
"sAya sangat sangaf kecewa ketika saya gak bisa verip mukaaa ..sedangkan uang saya mau di pake berobat Ade saya anehhh minta bantuan ke Diana malah rusngsingin,lama lama sayang gak bakalan pake DNA lagi","saya sangat sangaf kecewa ketika saya gak bisa verip mukaaa ..sedangkan uang saya mau di pake berobat ade saya anehhh minta bantuan ke diana malah rusngsingin,lama lama sayang gak bakalan pake dna lagi",1,1,1,1
nggak ada dana cicilnya,nggak ada dana cicilnya,1,0,1,1
"Mohon bantuan pada dana. kenapa nih, akun dana saya, gak bisa pay screen saya udah coba berulang kali tetap gagal","mohon bantuan pada dana. kenapa nih, akun dana saya, gak bisa pay screen saya udah coba berulang kali tetap gagal",3,1,0,1
"terkait pemindahan saldo dana akun lama ke akun baru saya belum di proses, saya akan kasih Bintang lima apabila kendala saya selesai di proses, terimakasih.","terkait pemindahan saldo dana akun lama ke akun baru saya belum di proses, saya akan kasih bintang lima apabila kendala saya selesai di proses, terimakasih.",1,1,0,0
"ini kenapa udah di upgrade tetep ga bisa ya, diulang-ulang terus","ini kenapa udah di upgrade tetep ga bisa ya, diulang ulang terus",2,1,0,1
"Maaf maaf sebelumnya, saya tidak punya cukup uang untuk beli hp baru. Tolong untuk dev. dari apl Dana harap agar device yginimum RAM 2 agar bisa membuka dana. Handphone saya tidak bisa membuka dana dan saldo saya terkunci disana. Tolonglah sayaa.....","maaf maaf sebelumnya, saya tidak punya cukup uang untuk beli hp baru. tolong untuk dev. dari apl dana harap agar device yginimum ram 2 agar bisa membuka dana. handphone saya tidak bisa membuka dana dan saldo saya terkunci disana. tolonglah sayaa.....",1,1,1,1
"apa² an dana ini ngirim uang ga bisa alasannya jaringan,pdahal buka tiktok atau kirim uang lewat ovo bisa,lagi gangguan atau gmn?","apa an dana ini ngirim uang ga bisa alasannya jaringan,pdahal buka tiktok atau kirim uang lewat ovo bisa,lagi gangguan atau gmn?",1,1,0,1
knp gak bisa di Update,knp gak bisa di update,2,1,0,1
"aplikasi tolol, kena penipuan malah gamau tau, dasar, cs nya juga kurang bgt ngeresponnya pokoknya tiati dah pake apk ini, apalagi kalo salah transfer pokoknya ga ngurus in tu apk","aplikasi tolol, kena penipuan malah gamau tau, dasar, cs nya juga kurang bgt ngeresponnya pokoknya tiati dah pake apk ini, apalagi kalo salah transfer pokoknya ga ngurus in tu apk",1,0,1,1
saya sudah melakukan transaksi udah berhasil transfer tapi kenapa saldo belum masuk,saya sudah melakukan transaksi udah berhasil transfer tapi kenapa saldo belum masuk,1,1,0,1
saldo saya tiba tiba hilang aplikasi tidak aman,saldo saya tiba tiba hilang aplikasi tidak aman,1,1,0,1
kenapa sekarang kok makin lemot ya... agak kecewa sih 👎👎,kenapa sekarang kok makin lemot ya... agak kecewa sih,2,1,0,1
"bikin qris dana buat terima pembayaran, trus qrisnya mau didonlot buat dicetak gak bisa2, udah ada tombol donlot padahal, tp bgitu tombol donlot diklik malah langsung pindah ke bagian perizinan hp, semua izin akses udah di ok in tetep aja bgitu klik donlot balik lagi ke layar perizinan terus2san, udah restart hp, udah hapus trus donlot ulang aplikasi, hp udah restart pabrik, udah login di hp lain juga, semuanya udah.. tetep bgitu klik donlot ga bisa.. udah chat cs nya jawabnya itu itu mulu,","bikin qris dana buat terima pembayaran, trus qrisnya mau didonlot buat dicetak gak bisa2, udah ada tombol donlot padahal, tp bgitu tombol donlot diklik malah langsung pindah ke bagian perizinan hp, semua izin akses udah di ok in tetep aja bgitu klik donlot balik lagi ke layar perizinan terus2san, udah restart hp, udah hapus trus donlot ulang aplikasi, hp udah restart pabrik, udah login di hp lain juga, semuanya udah.. tetep bgitu klik donlot ga bisa.. udah chat cs nya jawabnya itu itu mulu,",1,1,1,1
GOBLOG BANYAK KENDALA DANA TOLOL!!!!,goblog banyak kendala dana tolol!!!!,1,1,0,1
"Dana cicil tidak tersedia, padahal jelas2 saya sudah bayar aneh laporan ke email gk dpt solusi apa2","dana cicil tidak tersedia, padahal jelas2 saya sudah bayar aneh laporan ke email gk dpt solusi apa2",1,0,1,1
"setelah di update kenapa notifikasinya berubah menjadi ""biip"" kek hp rusak. .",setelah di update kenapa notifikasinya berubah menjadi biip kek hp rusak. .,2,1,0,1
"dana instan, limit segitu aja,eh lama lama bukan nya naik limitnya, malah sekarang tidak bisa dicairkan aneeh!!!","dana instan, limit segitu aja,eh lama lama bukan nya naik limitnya, malah sekarang tidak bisa dicairkan aneeh!!!",1,1,1,1
