content,cleaned_content,score,accuracy,completeness,satisfaction
lama banget sih eror teh,lama banget sih eror teh,1,1,0,1
hp dan nomor hilang ..??bagaimana cara login...???berbagai cara ttp tidak bisa login...tmbh fitur yg bisa TLP CS...auto chat ga membantu sama sekali...malah bikin emosi,hp dan nomor hilang ..??bagaimana cara login...???berbagai cara ttp tidak bisa login...tmbh fitur yg bisa tlp cs...auto chat ga membantu sama sekali...malah bikin emosi,1,1,1,1
tidak bisa di instal kembali butut!!,tidak bisa di instal kembali butut!!,2,1,0,1
"transfer ke bank kok jadi ada admin nya sihh, padahal suka bgt pake Dana tuh ya karena transaksi nya gratis 😭😌","transfer ke bank kok jadi ada admin nya sihh, padahal suka bgt pake dana tuh ya karena transaksi nya gratis",3,0,0,1
"dana gimana ini saya transaksi saldo udah berhasil tapi tak sampai tujuan, baru kali ini setelah update malah gak nyaman, apalagi uang yng dikirim tidak sedikit, tolong benahi lah,,","dana gimana ini saya transaksi saldo udah berhasil tapi tak sampai tujuan, baru kali ini setelah update malah gak nyaman, apalagi uang yng dikirim tidak sedikit, tolong benahi lah,,",2,1,0,1
lah ini gimana kenapa jaringan terus terputus padahal sinyal bagus,lah ini gimana kenapa jaringan terus terputus padahal sinyal bagus,1,1,0,1
"jelek, mending ovo... klo nomer ilang dan kita tau pasword/ pin dan nomernya ttp gak bsa dikonfirmasi. lalu klo nomernya di recovery oleh pihak provider dan di miliki oleh org lain bsa di miliki dana kita ke mereka. klo ovo beda meski gak ad nomernya ttp di miliki krna yg bikin pasword awal itu pembuat pertama.","jelek, mending ovo... klo nomer ilang dan kita tau pasword pin dan nomernya ttp gak bsa dikonfirmasi. lalu klo nomernya di recovery oleh pihak provider dan di miliki oleh org lain bsa di miliki dana kita ke mereka. klo ovo beda meski gak ad nomernya ttp di miliki krna yg bikin pasword awal itu pembuat pertama.",1,0,1,1
"lah menu tarik tunainya gak bisa dipake,cs dana aja ribet banget minta bantuan malah ngasih tutorial cara tarik.yg dipermasalahkan itu menu tarik tunai di apk gak fungsi njir","lah menu tarik tunainya gak bisa dipake,cs dana aja ribet banget minta bantuan malah ngasih tutorial cara tarik.yg dipermasalahkan itu menu tarik tunai di apk gak fungsi njir",1,1,1,1
"aku heran, aku punya point lumayan banyak, mau di tuker tapi semua barang udah habis, sungguh kecewa, lama-lama jadi pembodohan","aku heran, aku punya point lumayan banyak, mau di tuker tapi semua barang udah habis, sungguh kecewa, lama lama jadi pembodohan",2,0,1,1
"aplikasi tibatiba ngga bisa kepake, disistem tulisannya ada bug, udah coba hapus cache, update dan sampe reinstal pun tetep sama aja gabisa.","aplikasi tibatiba ngga bisa kepake, disistem tulisannya ada bug, udah coba hapus cache, update dan sampe reinstal pun tetep sama aja gabisa.",1,1,0,1
"notifikasi saldo masuk, tapi uang nya ga masuk, top pakai m banking, keterangan nya sukses tapi saldo di aplikasi dana nya ga masuk, aneh","notifikasi saldo masuk, tapi uang nya ga masuk, top pakai m banking, keterangan nya sukses tapi saldo di aplikasi dana nya ga masuk, aneh",1,1,0,1
kenapa ko dana saya belum ada dana cicil ya,kenapa ko dana saya belum ada dana cicil ya,1,0,1,0
"dapet hadiah event ga trus di cair kan, bikin kecewa","dapet hadiah event ga trus di cair kan, bikin kecewa",1,1,0,1
"dana saya d retas,,ada transaksi lain yg bukan saya,,keamannanya tolong d tingkatkan harus ada verifikasi 2 langkah dong,,masukan pin dan sidik jari min","dana saya d retas,,ada transaksi lain yg bukan saya,,keamannanya tolong d tingkatkan harus ada verifikasi 2 langkah dong,,masukan pin dan sidik jari min",1,0,1,1
"Tolong fitur nomor hilang, sediakan kembali, soalnya penting dan dibutuhin banget","tolong fitur nomor hilang, sediakan kembali, soalnya penting dan dibutuhin banget",3,0,1,0
punya ku ga ada pitur dana cicil nya,punya ku ga ada pitur dana cicil nya,1,0,1,0
"please knp dana makin kesini makin kesana, tolong lah aku gk pernh ngutang di dana cicil ngapa tiba tiba ada tagihan ngeri cok, udah 2x bayar tagihan goib gini parah jingah","please knp dana makin kesini makin kesana, tolong lah aku gk pernh ngutang di dana cicil ngapa tiba tiba ada tagihan ngeri cok, udah 2x bayar tagihan goib gini parah jingah",1,1,0,1
"aplikasi buruk, saldo kepotong trus, tiba"" ilang, bro lu bayangin gua yang cape kerja tiba"" saldo ilang gimana rasa nya, padahal itu saldo buat beli baju ade gua, dasar aplikasi sampah","aplikasi buruk, saldo kepotong trus, tiba ilang, bro lu bayangin gua yang cape kerja tiba saldo ilang gimana rasa nya, padahal itu saldo buat beli baju ade gua, dasar aplikasi sampah",1,1,0,1
"sorry bro ini aplikasi gw kasih rating segini dulu, jujurly gw pengusaha agent dana (alias jual saldo dana) kemarin gw kehilangan uang 1 juta lebih, dan yah memang ganjelnya dari aplikasi dana, masa orang lain narik ke gw terus depan gw secara nyata nyataan struknya udah ke kirim saldonya malah balik ke pemiliknya. itu yg ganjel dan gini bro setiap pengiriman dan gagal karna koneksi atau error ketika kirim lagi malah double transaksi. agen agen dana harus lebih teliti terhadap transaksi.","sorry bro ini aplikasi gw kasih rating segini dulu, jujurly gw pengusaha agent dana alias jual saldo dana kemarin gw kehilangan uang 1 juta lebih, dan yah memang ganjelnya dari aplikasi dana, masa orang lain narik ke gw terus depan gw secara nyata nyataan struknya udah ke kirim saldonya malah balik ke pemiliknya. itu yg ganjel dan gini bro setiap pengiriman dan gagal karna koneksi atau error ketika kirim lagi malah double transaksi. agen agen dana harus lebih teliti terhadap transaksi.",3,1,0,1
parah sibuk trus jaringan nya,parah sibuk trus jaringan nya,1,1,0,1
Makin kesini aplikasi ini makin kaya yg punya bukan membantu karuan ke sebelah point dpt lah ini??? 100X TOP UP 100X PULA DI POTONG LUAR BIASAH GK RATA pula 1000-500 cckckckckck,makin kesini aplikasi ini makin kaya yg punya bukan membantu karuan ke sebelah point dpt lah ini??? 100x top up 100x pula di potong luar biasah gk rata pula 1000 500 cckckckckck,1,0,0,1
"danaaa,,,ga mungkin gua mesti uninstall trus install lagi trus uninstall lagi trus install lagii,,cuma buat buka aplikasi dana doang,,,, tolong yaa,,,udah tahunan Lo,,gua pake aplikasi Lo,,🤕🤕🤕🤕","danaaa,,,ga mungkin gua mesti uninstall trus install lagi trus uninstall lagi trus install lagii,,cuma buat buka aplikasi dana doang,,,, tolong yaa,,,udah tahunan lo,,gua pake aplikasi lo,,",1,1,0,1
"kasih 1 dulu karena terlalu sering maintenance, pembayaran jadi terganggu","kasih 1 dulu karena terlalu sering maintenance, pembayaran jadi terganggu",1,1,0,1
"bagus si apk nya cepet ngirim nya tpi skrng klo buka apk dana ini tiba' koneksi internet terputus ktnya gajelas bangt jaringan bgus gada kendala tpi knpa bgtu, mohon di perbaharui lagi biar ga error' bgtu","bagus si apk nya cepet ngirim nya tpi skrng klo buka apk dana ini tiba koneksi internet terputus ktnya gajelas bangt jaringan bgus gada kendala tpi knpa bgtu, mohon di perbaharui lagi biar ga error bgtu",2,1,0,1
"kecewa dengan aplikasi dana , gak aman simpan uang, kalau gak bisa jaminin uang nasabah ngapain buka aplikasi,","kecewa dengan aplikasi dana , gak aman simpan uang, kalau gak bisa jaminin uang nasabah ngapain buka aplikasi,",1,0,0,1
"aplikasi aneh, dana cicil selalu tepat waktu dibayar, pas mau digunakan tidak bisa lagi, suruh hubungi Diana tetap gda jawaban yg jelas kenapa tidak bisa dipakai","aplikasi aneh, dana cicil selalu tepat waktu dibayar, pas mau digunakan tidak bisa lagi, suruh hubungi diana tetap gda jawaban yg jelas kenapa tidak bisa dipakai",1,1,1,1
"sudah bayar tagihan dana cicil mau pinjam lgi malah ga bisa di gunakan lagi dana cicil, ga jelas banget aplikasi dana","sudah bayar tagihan dana cicil mau pinjam lgi malah ga bisa di gunakan lagi dana cicil, ga jelas banget aplikasi dana",1,1,0,1
"kenapa gabisa di buka? tolong lah yg bener, saldoku bnyak disitu","kenapa gabisa di buka? tolong lah yg bener, saldoku bnyak disitu",2,1,0,1
"give away scam gimana sih udah stand by juga malah nggak ke refresh² hadiah nya gg meskipun udah di update, di refresh masih aja nggak ke refresh hadiah nya malah yang kemarin lawaaaak lawaaaaak looool looool","give away scam gimana sih udah stand by juga malah nggak ke refresh hadiah nya gg meskipun udah di update, di refresh masih aja nggak ke refresh hadiah nya malah yang kemarin lawaaaak lawaaaaak looool looool",1,1,0,1
JIKA CUSTOMER TIDAK PUNYA DANA ATAU GO-PAY JANGAN DI SUKSES KAN DONG PENGIRIMANNYA GIMANA SIH RUGI 2X KITA!!,jika customer tidak punya dana atau go pay jangan di sukses kan dong pengirimannya gimana sih rugi 2x kita!!,1,1,0,1
"limit dana cicil saya masih ada, tapi saya tidak bisa menggunakan nya, kalau begini terus dana, jangan salah saya menjadi nasabah yang tidak baik, ingat kita perlu hubungan timbal balik yaa","limit dana cicil saya masih ada, tapi saya tidak bisa menggunakan nya, kalau begini terus dana, jangan salah saya menjadi nasabah yang tidak baik, ingat kita perlu hubungan timbal balik yaa",1,1,0,1
"saya sudah lama menggunakan aplikasi ini, banyak transaksi, sudah premium.. tapi aplikasi ini mengecewakan. tidak diberi fitur dana instan. sangat sangat mengecewakan. dan saya memilih menggunakan e wallet ovo daripada dana","saya sudah lama menggunakan aplikasi ini, banyak transaksi, sudah premium.. tapi aplikasi ini mengecewakan. tidak diberi fitur dana instan. sangat sangat mengecewakan. dan saya memilih menggunakan e wallet ovo daripada dana",1,0,1,1
sudah premium tapi datamu sedang di cek. apalah ini dana gak jelas,sudah premium tapi datamu sedang di cek. apalah ini dana gak jelas,1,1,0,1
"kenapa sih dana di update udah ,mau ngirim gak kekirim kekirim bermasalah terus","kenapa sih dana di update udah ,mau ngirim gak kekirim kekirim bermasalah terus",1,1,0,1
turunin ke bintang 3. soalnya aneh dana cicil saya tiba2 sudah tidak bisa di pakai kembali padahal pembayaran lancar dan limitpun ada. tapi anehnya tidak bisa di pakai. tolong segera di perbaiki kembali min🙏,turunin ke bintang 3. soalnya aneh dana cicil saya tiba2 sudah tidak bisa di pakai kembali padahal pembayaran lancar dan limitpun ada. tapi anehnya tidak bisa di pakai. tolong segera di perbaiki kembali min,3,1,0,1
"saya laporkan aplikasi ini jika tidak sportif, saldo saya berkurang tidak sesuai dengan jumlah yang keluar. jika masih berlanjut, AKAN SAYA LAPORKAN KE MAHKAMAH KONSTITUSI DENGAN LAPORAN PENYALAHGUNAAN UANG MILIK PRIBADI !!!","saya laporkan aplikasi ini jika tidak sportif, saldo saya berkurang tidak sesuai dengan jumlah yang keluar. jika masih berlanjut, akan saya laporkan ke mahkamah konstitusi dengan laporan penyalahgunaan uang milik pribadi !!!",1,1,0,1
"gua instal lagi kalo saldo GK masuk smua temen"" bakal unistal apak ini",gua instal lagi kalo saldo gk masuk smua temen bakal unistal apak ini,1,1,0,1
"kok semakin jelek aplikasinya.udah do download dn mau masuk untuk daftar, katanya nunggu sebentar,kami ada masalah gangguan internet.berulang kali, selalu aja sama.gimana nih caranya","kok semakin jelek aplikasinya.udah do download dn mau masuk untuk daftar, katanya nunggu sebentar,kami ada masalah gangguan internet.berulang kali, selalu aja sama.gimana nih caranya",2,1,0,1
ko punya saya gak dapet aplikasi dana cicil yaa????,ko punya saya gak dapet aplikasi dana cicil yaa????,3,0,1,0
"tolong pihak dana segera kasih klarifikasi/kejelasan pembayaran wifi tertgl 20 feb 2026 berhasil tapi pihak Telkom tidak menerima/refund per tgl 10 maret... udh dikonfirmasi satu bilang gak terima yg satu bilang berhasil ,,,nilai gak seberapa tapi kepercayaan sudah GK ada...terima kasih","tolong pihak dana segera kasih klarifikasi kejelasan pembayaran wifi tertgl 20 feb 2026 berhasil tapi pihak telkom tidak menerima refund per tgl 10 maret... udh dikonfirmasi satu bilang gak terima yg satu bilang berhasil ,,,nilai gak seberapa tapi kepercayaan sudah gk ada...terima kasih",2,1,0,1
saldo ilang loncong ngelag,saldo ilang loncong ngelag,1,1,0,1
terpaksa kasi bintang satu karena baru kali ini saya beli paket data di dana beli 15gb seharga 75k masuk paket data nya 7gb,terpaksa kasi bintang satu karena baru kali ini saya beli paket data di dana beli 15gb seharga 75k masuk paket data nya 7gb,1,1,0,1
saldo di bisnis saya tidak bisa di cairkan,saldo di bisnis saya tidak bisa di cairkan,1,1,0,1
"tolol sampah!!!! pembayaran lewat qris tapi muncul keterangan gangguan, terus saldo mlah terpotong !!! tanpa ada bukti transaksi... perbaiki lagi aplikasi gk jelasss..","tolol sampah!!!! pembayaran lewat qris tapi muncul keterangan gangguan, terus saldo mlah terpotong !!! tanpa ada bukti transaksi... perbaiki lagi aplikasi gk jelasss..",1,1,0,1
nga ada dana cicil nya,nga ada dana cicil nya,1,0,1,0
makin buruk pembayaran di tolak terus gak bisa transfer keluar padahal lagu butuh,makin buruk pembayaran di tolak terus gak bisa transfer keluar padahal lagu butuh,1,1,0,1
aman dan terpercaya tapi Syg Bnget Dana cicil tidak Tersedia atau tidk Berlaku mohon segerah di perbaikan,aman dan terpercaya tapi syg bnget dana cicil tidak tersedia atau tidk berlaku mohon segerah di perbaikan,3,0,1,1
"2 kali isi masuk tapi ga nambah ke total uang, komplen yg balas robot ga ada jalan keluar","2 kali isi masuk tapi ga nambah ke total uang, komplen yg balas robot ga ada jalan keluar",1,1,1,1
aplikasi yang sering trobel 👎👎👎,aplikasi yang sering trobel,2,1,0,1
Bagus sih berguna banget. Hanya saja kalau tidak mau ngasih Dana cicil lagi akibat telat bayar tapi sy lunasin kok. Pas mau bayar token ehdana cicilnya gak bisa karena iklannya muncul terus gitu ayoo bayar pake dana cicil.S aat ini dana cicil tidak tersedia .tolong di bagian menu atau dana paylater gak usahlah dimunculkan kalau tidak mau ngasih dancil lagi,bagus sih berguna banget. hanya saja kalau tidak mau ngasih dana cicil lagi akibat telat bayar tapi sy lunasin kok. pas mau bayar token ehdana cicilnya gak bisa karena iklannya muncul terus gitu ayoo bayar pake dana cicil.s aat ini dana cicil tidak tersedia .tolong di bagian menu atau dana paylater gak usahlah dimunculkan kalau tidak mau ngasih dancil lagi,3,1,1,1
