content,cleaned_content,score,accuracy,completeness,satisfaction
woi dana ku masuk ke game ganti rugi sekarang gw gk bisa beli kuota parah bisa masuk game tanpa verifikasi,woi dana ku masuk ke game ganti rugi sekarang gw gk bisa beli kuota parah bisa masuk game tanpa verifikasi,1,1,0,1
"Kenapa aku gak bisa masuk ke akun Danaku,.","kenapa aku gak bisa masuk ke akun danaku,.",1,1,0,0
saya suka sama aplikasi dana ini... cuma semakin lama semakin rumit dii gunakan nyahh kaya banyakk gangguan nyah,saya suka sama aplikasi dana ini... cuma semakin lama semakin rumit dii gunakan nyahh kaya banyakk gangguan nyah,2,1,0,1
"Tidak Bisa Scan Barcore Di Menu Pembayaran Scan , Gambar Tidak Ada Digaleri padahal Sudah Di Download","tidak bisa scan barcore di menu pembayaran scan , gambar tidak ada digaleri padahal sudah di download",1,1,0,0
Sering ERROR!! SISTEM UI nya juga gak friendly untuk hp kelas menengah alias Aplikasinya Berat banget!!!,sering error!! sistem ui nya juga gak friendly untuk hp kelas menengah alias aplikasinya berat banget!!!,2,1,0,1
"masa iya saya ga boleh kirim uang saya sendiri sih, aplikasi terus menerus bug.","masa iya saya ga boleh kirim uang saya sendiri sih, aplikasi terus menerus bug.",1,1,0,1
paket data padahal ada kok gk bisa login dana malah koneksi internet terputus ni tolong lah pihak dana bantu hilangkan bug nya,paket data padahal ada kok gk bisa login dana malah koneksi internet terputus ni tolong lah pihak dana bantu hilangkan bug nya,1,1,0,0
malem temen saya tf uang 700 ribu uang udh di kirim transaksi ga muncul saya ngchat admin atas nama Diana. dia minta transaksi yang 700 ribu ituu ...gimna mau ngasih nya transaksi nyaa juga blom muncul ke dana temen saya.,malem temen saya tf uang 700 ribu uang udh di kirim transaksi ga muncul saya ngchat admin atas nama diana. dia minta transaksi yang 700 ribu ituu ...gimna mau ngasih nya transaksi nyaa juga blom muncul ke dana temen saya.,1,1,1,1
"tolong kembalikan uang saya, sedikit banyaknya itu uang saya, saya melakukan transaksi dari DANA ke rekening Bank, transaksi berhasil tapi uang tidak masuk ke rekening, teman saya juga mengalami hal yang sama,pernah melakukan transaksi 1jt sampai hari ini tidak ada kabar dri pihak dana, kinerja dana sangat buruk !","tolong kembalikan uang saya, sedikit banyaknya itu uang saya, saya melakukan transaksi dari dana ke rekening bank, transaksi berhasil tapi uang tidak masuk ke rekening, teman saya juga mengalami hal yang sama,pernah melakukan transaksi 1jt sampai hari ini tidak ada kabar dri pihak dana, kinerja dana sangat buruk !",1,1,0,1
kecewa banget dana cicilnya gagal terus dan gk bisa di gunain,kecewa banget dana cicilnya gagal terus dan gk bisa di gunain,1,1,0,1
kok harus update ke premium buat transaksi????,kok harus update ke premium buat transaksi????,1,0,1,1
limit dana cicil tidak bisa dpakai,limit dana cicil tidak bisa dpakai,3,1,0,0
tolong dong yang bener saya lagi butuh banget minta utangan malah dananya gax bisa masuk tolong admin dana saya lagi kesusahan uangnya gax bisa di ambil karna gax bisa masuk akun dana,tolong dong yang bener saya lagi butuh banget minta utangan malah dananya gax bisa masuk tolong admin dana saya lagi kesusahan uangnya gax bisa di ambil karna gax bisa masuk akun dana,1,1,0,1
banyak bug nya tolong di perbaiki lagii nyesel aing pake dana,banyak bug nya tolong di perbaiki lagii nyesel aing pake dana,2,1,0,1
Dana ini merepotkan kalau nomor sudah hilang sudah tidak bisa masuk karna sudah tidak bisa menerima kode otp. ganti nomor akunya saja stengah mati.,dana ini merepotkan kalau nomor sudah hilang sudah tidak bisa masuk karna sudah tidak bisa menerima kode otp. ganti nomor akunya saja stengah mati.,1,0,1,1
saya isi saldo mutasi udah masuk tapi isi saldo ga nambah gimana ceritanya coba,saya isi saldo mutasi udah masuk tapi isi saldo ga nambah gimana ceritanya coba,1,1,0,1
"saldo saya kesedot karena tidak mengetahui ada nya langganan, padahal kira saya itu gratis","saldo saya kesedot karena tidak mengetahui ada nya langganan, padahal kira saya itu gratis",1,0,0,1
DANA CICIL dan DANA INSTAN tidak bisa di pakai buat apa? buat PAMER? Aplikasi DANA BUSUK,dana cicil dan dana instan tidak bisa di pakai buat apa? buat pamer? aplikasi dana busuk,1,1,0,1
sangat buruk saat verivikasi dan Diana sangat tidak berguna,sangat buruk saat verivikasi dan diana sangat tidak berguna,1,1,1,1
"Percuma Previkasi wajah dan kode kalo Masih minta OTP,,kartu sudah hilang ,,,dana semakin hati semakin jelek ,,,tolong dong jangan ada otp lagi ...","percuma previkasi wajah dan kode kalo masih minta otp,,kartu sudah hilang ,,,dana semakin hati semakin jelek ,,,tolong dong jangan ada otp lagi ...",1,0,1,1
tiap kali mau bayar buat top up ep ep eror terus iw,tiap kali mau bayar buat top up ep ep eror terus iw,1,1,0,1
oke bagus dan cepat,oke bagus dan cepat,3,0,0,0
"min kenapa saya setiap top up suka hangus sendiri padahal gak punya tagihan sama gak belanja, mohon jawaban dan pertanggung jawabannya min","min kenapa saya setiap top up suka hangus sendiri padahal gak punya tagihan sama gak belanja, mohon jawaban dan pertanggung jawabannya min",2,1,0,1
upgradenya prosesnya lama sedangkan saya butuh uangnya buat trasfer,upgradenya prosesnya lama sedangkan saya butuh uangnya buat trasfer,1,1,1,1
"sumpah lemot, mau kirim uang ga bisa di pencet, aplikasi nya lama lama aneh, ga jls","sumpah lemot, mau kirim uang ga bisa di pencet, aplikasi nya lama lama aneh, ga jls",1,1,0,1
ini gimana ya kok ada tulisan saldo melewati batas,ini gimana ya kok ada tulisan saldo melewati batas,1,1,0,0
dev nya tolol ngantuk,dev nya tolol ngantuk,1,0,0,1
saldo hilang tanpa ada mutas,saldo hilang tanpa ada mutas,1,1,0,1
tidak bisa masuk akun dana kembali terus,tidak bisa masuk akun dana kembali terus,1,1,0,0
"buat pengguna dana lebih baik pindah sebelum menyesal pake akun dana,,","buat pengguna dana lebih baik pindah sebelum menyesal pake akun dana,,",1,0,0,1
"kurang kompeten sudah 3 tahun menggunakan dana premium, transaksi sudah lebih batas , diajukan sudah beberapa kali tapi tidak tangani dengan sigap , apalagi bicara sama asisten bodoh diana bicaranya muter2 perkataan terus diulang","kurang kompeten sudah 3 tahun menggunakan dana premium, transaksi sudah lebih batas , diajukan sudah beberapa kali tapi tidak tangani dengan sigap , apalagi bicara sama asisten bodoh diana bicaranya muter2 perkataan terus diulang",1,0,1,1
GX muncul2 fitur dana cicil/instan nya,gx muncul2 fitur dana cicil instan nya,1,0,1,0
"dana lu kenapa sih, gw udah masukin pin dengan benar dan verivikasi wajah tetapi diminta untuk memasukan kode otp nah kan kartu gw ilang jadi gimana mau dapet otp nya, padahal kalo udah masukin pin sama verifikasi wajah gausah minta kode otp mikir dulu orang tuh nomernya ada yang hilang ga yaaaa atau ada yang ga aktif ga yaa, pokoknya gamau tau kalo udah masukin pin dengan benar dan verivikasi wajah gausah deh minta minta kode otp segala mana tu akun ada saldonya, gw kena marah ibu gw karna ini","dana lu kenapa sih, gw udah masukin pin dengan benar dan verivikasi wajah tetapi diminta untuk memasukan kode otp nah kan kartu gw ilang jadi gimana mau dapet otp nya, padahal kalo udah masukin pin sama verifikasi wajah gausah minta kode otp mikir dulu orang tuh nomernya ada yang hilang ga yaaaa atau ada yang ga aktif ga yaa, pokoknya gamau tau kalo udah masukin pin dengan benar dan verivikasi wajah gausah deh minta minta kode otp segala mana tu akun ada saldonya, gw kena marah ibu gw karna ini",1,0,1,1
"sering terjadi gangguan ketika login gajelas sinyal aku padahal bagus,tapi tetep aja gak bisa login karena alasan koneksi jaringan tidak stabil,SAMPAH","sering terjadi gangguan ketika login gajelas sinyal aku padahal bagus,tapi tetep aja gak bisa login karena alasan koneksi jaringan tidak stabil,sampah",1,1,0,1
kenapa saya tidak bisa mengakses dana cicil. padahal saya sering menggunakan apk dana ini,kenapa saya tidak bisa mengakses dana cicil. padahal saya sering menggunakan apk dana ini,3,1,0,0
"jangan pake akun dana bisa saldo anda berkurang,saya kecewa dengan aplikasi dana sekarang makin lama makin membuat saldo anda dipotong secara otomatis......... jgn download nanti Anda akan menyesal.....","jangan pake akun dana bisa saldo anda berkurang,saya kecewa dengan aplikasi dana sekarang makin lama makin membuat saldo anda dipotong secara otomatis......... jgn download nanti anda akan menyesal.....",1,1,0,1
kenapa selalu ada kendala pada jaringan padahal internet lancar tapi apk tidak bisa merespon sedangkan mau mencairkan uwang jadi terkendala,kenapa selalu ada kendala pada jaringan padahal internet lancar tapi apk tidak bisa merespon sedangkan mau mencairkan uwang jadi terkendala,1,1,0,0
tidak ada fitur dana cicil nya gk bagus,tidak ada fitur dana cicil nya gk bagus,1,0,1,1
kenapa yaa akun dana saya ga bisa uprage dana premium??? jd gak bisa kirim uang ke bank saya laahh...???😄😥😭😭😭kecewa saayaa deh... saya kasih bintang 2 aja lah,kenapa yaa akun dana saya ga bisa uprage dana premium??? jd gak bisa kirim uang ke bank saya laahh...??? kecewa saayaa deh... saya kasih bintang 2 aja lah,2,1,1,1
"Riwayat aktivitas error terus, unistal app, bahkan format hp hasilnya sama. bukan masalah cache dll memang bug appnya","riwayat aktivitas error terus, unistal app, bahkan format hp hasilnya sama. bukan masalah cache dll memang bug appnya",1,1,0,0
voucher gk bisa di pake,voucher gk bisa di pake,2,1,0,0
di atas jam 10 suka gangguan,di atas jam 10 suka gangguan,1,1,0,0
makin gajelas aja nih aplikasi mau pindah akun aja susahnya minta ampun parah banget!!!,makin gajelas aja nih aplikasi mau pindah akun aja susahnya minta ampun parah banget!!!,1,0,1,1
tidak aman menggunakan dana .. saldo sebulan 2x di sedot.. menghubungkan layanan yang jawab BOT,tidak aman menggunakan dana .. saldo sebulan 2x di sedot.. menghubungkan layanan yang jawab bot,1,1,1,1
tolong jangan pake klarifikasi wajah,tolong jangan pake klarifikasi wajah,3,0,1,0
sangat mengecewakan penjualan Reksadana berhasil tapi saldo belom masuk...parah sangat merugikan,sangat mengecewakan penjualan reksadana berhasil tapi saldo belom masuk...parah sangat merugikan,1,1,0,1
saya menyesal mendownload dana,saya menyesal mendownload dana,1,0,0,1
ga jelas tiba tiba duwit gua ke potong padahal gua kaga beli apa apa yang tadi ya 30k jadi 12k aduhh emang juga itu duwit buat jajan malah di potong se banyak itu,ga jelas tiba tiba duwit gua ke potong padahal gua kaga beli apa apa yang tadi ya 30k jadi 12k aduhh emang juga itu duwit buat jajan malah di potong se banyak itu,1,1,0,1
"heii manusia², sblm terjadi sama kalian, aku mqu bilang jangan pakai dana, ini aplikasi penipu, aplikasi yg banyak ngambil uang orang, aplikasi yg apabila kita transaksi, tulisan nya berhasil dan saldo kita terpotong namun yg kita beli tidak kita dapat kan, seperti kuota, saldo tol dll, kalau ga percaya search aja TT, sudah banyak korban dari dana ini, mari jatuhkan dana.","heii manusia , sblm terjadi sama kalian, aku mqu bilang jangan pakai dana, ini aplikasi penipu, aplikasi yg banyak ngambil uang orang, aplikasi yg apabila kita transaksi, tulisan nya berhasil dan saldo kita terpotong namun yg kita beli tidak kita dapat kan, seperti kuota, saldo tol dll, kalau ga percaya search aja tt, sudah banyak korban dari dana ini, mari jatuhkan dana.",1,1,0,1
"putur dana instan dan pitur dana cicil saya ga muncul, parah banget","putur dana instan dan pitur dana cicil saya ga muncul, parah banget",1,0,1,1
